id,type,section_id,section_name,web_publication_date,web_title,headline,trail_text,body_text,is_hosted,pillar_id,pillar_name
lifeandstyle/2023/nov/04/brexit-lack-of-cash-politics-has-the-uk-cycling-revolution-run-out-of-road,article,lifeandstyle,Life and style,2023-11-04T17:00:44Z,"Brexit, lack of cash, politics: has the UK cycling revolution run out of road?","Brexit, lack of cash, politics: has the UK cycling revolution run out of road?","Bike sales boomed during the pandemic, but now cycle shops are going bust, sales of ebikes are sluggish and there’s a downturn in ‘active travel’","When Alice Clews-Smith and her partner, Kitty, moved to London, they didn’t see many options for pursuing their shared passion for cycling. “I think it’s fair to say that the industry and the cycling scene were very male dominated,” she said. “There was a lack of space for women, trans-femme, non-binary people. We wanted a space where these people could feel welcomed and included. And because not everything is about going fast in Lycra.” So was born the Steezy Collective, which brings together cyclists across the UK. Not that going fast is off the table. The collective noticed that there were no women in the Fastest Known Times list for the Lakeland 200 route – 200km of mountain bike trails through the Lake District – so they set about correcting that, and now the list includes nine women riders, with their efforts captured on film. The existence of the Steezy Collective and others such as Sisters in the Wild, the Lakes Gravel Gang, the New Forest Off Road Club and 6am Cycling is part of a new wave of enthusiasts fuelled by the lockdown bicycle boom. Riders are now much more diverse than the cliched and not entirely accurate stereotype of middle-aged men in Lycra. With miles of cycle paths opening up in cities across the UK, people reacted during the pandemic lockdowns by buying bikes in record numbers, with latecomers facing months-long waits. By March 2021, cycle traffic in England was 64% higher than in December 2013. Now that has all changed. Last week, Wiggle Chain Reaction Cycles, one of the UK’s largest online cycle retailers, went into administration while Islabikes, which transformed the design of children’s bikes to make them lighter and easier to handle, said that it would stop manufacturing. The announcements came after three major UK distributors went bust, along with German company Signa Sports United, and the Italian firm Bianchi announced redundancies, Cycling Weekly reported. So what went wrong? “We could see it before anyone else,” said Martin Shepherd at Reynolds Technology in Birmingham, which for the past 125 years has made steel tubes used to create bicycle frames. “During the pandemic, you couldn’t ship bikes fast enough,” he said. “Everybody’s lead time for orders [mostly to Taiwanese factories] started to go up nine months in advance, 12 months in advance. “Now we’ve come out of the other side of it, there’s just vast amounts of inventory because all those people who were having to order 500 bikes 18 months in advance were suddenly swamped with stock.” Customers, on the other hand, had been hit hard in their bank accounts. Sales have dipped, leaving companies with stock that’s proving hard to shift – something analyst Velco described as an economic “whiplash effect”, where small changes are magnified down the supply chain. Some bikes can now be bought at steep discounts since 2024 models will be arriving in a matter of weeks. Shepherd said high interest rates, as well as post-Brexit trade barriers, were also playing their part. UK firms have specialised in mid- and high-end bikes, and sales to Europe had been substantial, but they have been hit by customs delays and extra charges. Now is an excellent time to buy a bike, but those bargains come with a price tag for the sector. If the market is flooded with more cheap stock, it could drive more firms out of business. “In the long term, it could result in less choice for consumers because the more high street shops that shut, the less people there are to fix a bicycle or advise them,” said Jonathan Harrison, director of the Association of Cycle Traders, which represents retailers and repairers. There have already been “quite a lot” of closures, he said, and there are now about 2,700 bike shops in the UK and another 1,100 workshops, hire centres and bike cafes. “The likes of Wiggle closing will have impacts on other businesses, too, because a lot of distributors have been over-reliant on them as a sales channel,” Harrison said. “So we will see further repercussions happen, particularly in the supply chain. But I think the market will bounce back. We still think there is room for growth in the number of people cycling.” There is another headwind for cyclists blowing from Westminster. Inspired by a narrow victory in the Uxbridge byelection in July, Rishi Sunak declared the end of an alleged “war on drivers”. Whether that amounts, as some fear, to a declaration of a new war on pedestrians and cyclists remains to be seen – the prime minister’s plan for drivers includes a clampdown on 20mph speed limits, bus lanes and low-traffic neighbourhoods (LTNs), having slashed funds for cycle lanes and pavements in March. Last Friday, the Commons’ public accounts committee said there had been “disappointingly slow” progress on increasing active travel. The Department for Transport has been ordered to conduct an LTN review and has canvassed views from local authorities, which campaigners say could lead to reopening rat runs closed years ago by tarmacking over cul-de-sacs and ripping out bollards and other so-called modal filters. “During Covid we saw a massive increase in levels of cycling,” said Duncan Dollimore, head of campaigns at Cycling UK. “Since then, the numbers have dropped substantially and we’ve lost all the benefits. And part of the reason is government policy. “There used to be a cross-party consensus on active travel, but there’s been a very substantial change in tone over the last 18 months. The whole narrative from the government has been very much against anything that’s perceived to be green, and it’s quite toxic.” He said that a media campaign with “a certain degree of vilification of people cycling has an effect on people and then puts people off. The narrative against cycling isn’t helping these local industries.” Phillip Darnton, the chair of the Bicycle Association, which represents larger manufacturers and retailers, said they have been trying to persuade ministers that the cycling industry presents an opportunity to boost economic growth. “The whole industry is surprisingly valuable,” he said. “It’s probably generating about £7.5bn of added value to the UK economy and, if you include livelihoods, employs about 64,000 people.” While it is often tempting to look enviously at the Netherlands and Denmark, which have been investing in cycling and cycle lanes since the 1973 oil crisis, Darnton pointed to Germany as inspiration. “In Germany last year they sold about 2.2m electric bikes and were disappointed they couldn’t satisfy the last 100,000 orders,” he said. “In the UK, we struggled to sell 150,000.” France has had huge growth in ebike sales, he added, because the government had offered some modest subsidies. “The French say it’s not about how many euros or pounds but the very fact that the government says: ‘This is the strategy – we want to urge you not to use a car for short urban trips’ and makes it attractive for businesses to make deliveries in the last mile by cargo bike.” Cargo bikes – larger, usually electric, bikes with a separate carrier – are one remaining bright spot, with people adopting them in growing numbers. The trend is particularly noticeable in Cambridge, where it was instrumental in shielding Outspoken Cycles, which sells and services bikes in the city, from the worst of the lockdown effects, according to the shop’s general manager, Robert Hampton. “We haven’t had the overstock issue for cargo bikes,” he said. “We’re now back to a lead time of about four weeks. It’s been steady growth: 20% more this year than last year, and 20% more last year than the year before. It’s much more of a steady increase of people looking more to move out of using a car for everyday journeys.” Meanwhile, there are still plenty of riders who take the sport seriously, whether that’s taking one of the dozens of routes through the flat Cambridge Fens or the hills of the Yorkshire Dales. While appetites for a £300 commuter bike have waned, people who want to add another £10,000 bike to their collection are still doing so, according to Shepherd. At 6am Cycling, there is room for both types of rider. The club was started by Tom Glendining and Lesley Sharpe in 2015 and really took off when they began their Fri-Up rides – a dawn trip through Epping Forest followed by a coffee. “It just started through a group of us going out really early on a Friday morning,” Glendining said. “And more people started joining. “Everything’s shifted. Loads of girls getting into it now, which is fantastic. There’s Brothers on Bikes trying to get Muslim dudes out on bikes – they’ve started joining the fry-up rides as well. It’s not all about going fast – although we’ve got them too. There’s guys who ride with 6am who are incredibly strong riders and have done national time trials and all that. They’re all really lovely people. The main thing is you’ve got to be nice.” • This article was amended on 6 November 2023 to correct a reference to the 6am Cycling club’s Fri-Up rides, which end with a coffee. An earlier version mistakenly referred to them as “Fri-Day” rides and said they were followed by “a fry-up”.",False,pillar/lifestyle,Lifestyle
global-development/2023/nov/13/mahua-moitra-not-making-excuses-hypocrisy-in-indian-politics-and-her-terrible-taste-in-men,article,global-development,Global development,2023-11-13T06:00:25Z,Grit and glamour: how Mahua Moitra shook up the misogyny and hypocrisy of Indian politics,Grit and glamour: how Mahua Moitra shook up the misogyny and hypocrisy of Indian politics,"A divorcee who likes a glass of wine and a pair of Ferragamo shoes, the opposition MP has become a target for character assassination for Narendra Modi’s conservatives. But she hits back twice as hard","Mahua Moitra is a misfit in Indian politics. She rejects the notion that a woman must ideally be married, and if she happens to be divorced, single or widowed, should not openly date or be seen to be in a relationship. Nor should she drink or smoke in public or be seen arm in arm with a man. Moitra, 49, is a divorcee. She drinks wine occasionally, has her nails done once in a while, likes Ferragamo shoes and carries a Louis Vuitton handbag. It gets worse. She went to college in the US and was a banker with JP Morgan Chase in New York and London, so is, ipso facto, westernised. As an opposition MP from West Bengal, she denounces the ruling party and has accused the prime minister, Narendra Modi, of cronyism in allegedly favouring the controversial tycoon Gautam Adani. When attacked, she hits back twice as hard, usually topped with a dollop of withering sarcasm. Is it any wonder that she feels she is a target for character assassination, particularly from members of the ruling Bharatiya Janata party (BJP), with its conservative notions about society and women? Moitra accuses the BJP of portraying her in an unflattering light by circulating photos, taken at a private birthday party in 2020, that show her leaning into a fellow MP with a glass of wine in her hand. She says a jilted ex cropped the photos and gave them to the BJP to circulate on social media. “I’m not going to make excuses for who I am. I am not going to change who I am to fit the paradigm. Let the paradigm shift with me. When I returned to India to enter politics, I was clear that I wanted to be in public life but by being myself,” she says. It’s a grey, smog-filled morning in New Delhi and Moitra is sitting on a leather armchair in her elegantly furnished official bungalow. Her hair is damp from a shower and she’s wearing a casual skirt and white top. Her rottweiler, Henry (“he thinks he’s King Henry”), alternates between slobbering by her side or sprawling on the leather coffee table. Moitra shows no sign of fatigue after a bruising few weeks of news coverage. First it was the ex and the photos. “I have terrible taste in men,” she says. Then a BJP MP accused her of accepting bribes to ask questions in parliament at the behest of a businessman – charges she has dismissed as absurd, telling one interviewer that she has no need of bribes to buy upmarket shoes because she can buy them herself. As to the “expensive gifts” she is accused of accepting, she says one – a Hermès scarf – was a birthday gift and the other was some Bobbi Brown makeup brought in duty free by a friend. The accusations, she says, are all part of the usual misogyny in Indian politics – she is often referred to as “ambitious” and “domineering” – which she says has been made worse by the BJP’s 10-year rule. The media ordeal she has been subjected to is, she says, an attempt by the BJP to stop her relentless attacks on the government over Adani. If Moitra does not conform to the stereotype of a female politician, it’s because no one told her what it was. She grew up in a family in Kolkata where gender equality was a given. “My family is progressive and non-traditional. I didn’t grow up with Indian roles of how a woman should be.” When Moitra came back to India in 2008 to enter politics, the party she ultimately joined, the Trinamool Congress, was (and still is) led by a woman, Mamata Banerjee, who encourages women to be themselves. Almost half the party’s MPs in the national parliament are women, far more than for other parties. Moitra’s party rules in the state of West Bengal. The state, like others, has its own pantheon of Hindu gods and goddesses, which include two who embody feminine power. “In Bengal, we see the feminine form and women not as submissive but as shakti [strength]. Our goddesses are Kali or Durga, strong conquerers,” Moitra says. These factors encouraged her to believe that she could engage in grassroots political activity without getting caught up in the hypocrisies of Indian politics. These hypocrisies include having clandestine sexual relationships and dressing down to signal a pro-poor image – while the drawers at home are maybe full of Rolex watches and Gucci sandals, accessories reserved for private functions when no photographers are around. Moitra refuses to go along with this pretence. “I like to be fit, I like to look a certain way,” she says. “My constituents don’t want me to look unwashed and unkempt. If I’m in boring clothes, they tell me to wear bright colours.” A friend, supreme court lawyer Rebecca John, explains why Moitra is one of a kind in politics. “The Indian man, more so the politician, cannot handle a woman who has a brain, is well educated, understands finance, is confident, and exercises sexual agency. That’s why the right goes after her,” she says. In early November, when Moitra appeared before the parliamentary ethics committee to answer questions on the corruption allegations, she stormed out, along with half the panel, after being asked insulting and salacious questions by the chair. Questions included: Who do you talk to late at night and how many times? You call so and so a dear friend … does his wife know? Give us a log of your late-night calls. Which hotels do you stay in and who with? “You can say no if you don’t want to answer,” said the chair. “Do you mean to tell me you can ask me if I am a prostitute and I should say no?” a furious Moitra asked the chair, a BJP MP. Today she says: “I mean if someone like Dominic Cummings uses the C-word for a woman, it’s bad, but at least it was in private. This was the chair of an official committee talking to me like this in public.” At this point Henry starts whimpering, thinking her raised voice means she is upset. She gets up to cuddle him before conceding that perhaps there is one thing she needs to change about herself: her choice of men. “Let’s face it, this has distracted to an extent from the focus I want to give my constituents. In public life, you have to be extra selective about who you let into your life,” she says. Moitra is not so conceited to think she can be a role model for anyone, but she is certain that new role models are badly needed for women in public life. “If I can be the first politician who is comfortable in her own skin, I’m good with that.”",False,pillar/news,News
commentisfree/2023/dec/20/big-power-politics-world-order-un-icc,article,commentisfree,Opinion,2023-12-20T07:00:05Z,2023 has shown us the misery big-power politics creates. Here’s how we can do things differently | Margus Tsahkna,2023 has shown us the misery big-power politics creates. Here’s how we can do things differently,"The ‘rules-based world order’ is no more than a myth. It’s time for a major overhaul of institutions from the UN to the ICC, says Estonia’s minister of foreign affairs Margus Tsahkna","Our rules-based world is the triumph of peace over war. At least, that’s how the story has been told for the past eight decades. The promise of “never again” has been the raison d’etre for global institutions such as the United Nations and the international criminal court (ICC), which all like to trace their history to the moment when nations emerged from the ruins of the second world war and forged a lasting peace. Rising freedom and prosperity was understood to be the byproduct. Yet increasing numbers of people around the world no longer believe in that story. Its promise has been broken with the return of full-scale aggression by Russia, along with deteriorating violence and instability around the world. We are witnessing the horrors that this system was supposed to have long ago eliminated. International institutions now too often seem powerless, at best, to deal with the most serious challenges of our time. At worst, they are complicit in enabling them. With confidence rapidly fading, the entire system risks collapse. That would mean the return to an age of empires in which “might makes right”, and everyone suffers. I now hear people around the world ask, with ever-increasing urgency, about how we can save our rules-based international system. I also hear frustrations that not everyone seems to be equally invested in saving it. But we cannot merely hope to save the existing rules-based international system from the crises that this system led us to, nor expect everyone to be passionate about something they do not feel is working for them. If it can fail once, it will fail again. It needs fundamental change. Russia’s ongoing and barbaric war of aggression against Ukraine did not just break the system. It exploited some of its many flaws to degrade its apparently unenforceable norms and values. If that continues, we will all eventually lose interest in saving the system. In saving a rules-based system, we have to admit how, across Africa and parts of Europe, victims of imperial conquest feel disengaged from it. Similarly, during the second world war the smaller nations of eastern Europe found themselves forced into “spheres of influence” and had horrific aggression unleashed on them. As someone who grew up under that Soviet occupation, I understand how it feels to be shut off from the world and shut out from decisions affecting your own life and those around you. Our rules-based world is really a continuing story about how we free ourselves from big-power politics and the misery and devastation that it brings to everyone. That’s a story we can all believe in. We can end big-power politics for good by ensuring everyone has the freedom to contribute to international decision-making. Individuals, communities, even entire nations and regions currently just don’t have a proper say in the decisions that affect them. We need to forge an international system far more resilient to aggressors, but also far better equipped to deal with poverty, disease, and the climate crisis. That’s why Estonia is calling for a new global conversation about how to make the world fit for freedom. First, we must strengthen the international rules-based order by admitting its flaws and ensuring it better reflects the realities of the 21st century. That includes reform of the UN. The security council needs additional permanent members to better reflect our modern world. It must also be reminded that it has primary, not exclusive, responsibility for international peace and security. We must protect the world from abusive veto-users. We can do that by supporting the French-Mexican initiative on veto restraint and the code of conduct by the accountability, coherence and transparency group on not voting against resolutions aimed at ending mass atrocities. But we need to be even more creative and ambitious. That’s why, to get started, we propose forming a core group to analyse the course of action to be taken by the general assembly when a permanent member of the security council tramples on the UN charter. Just as seriously, the ICC has been left without jurisdiction over the crime of aggression, even though it was established as the supreme crime of international law at the Nuremberg trials of the Nazis, and finally defined by all nations in 2010. This is the most striking example of a broken international system that allows the open violation of its most basic of international principles with impunity. The Rome statute of the ICC needs to be reviewed to ensure accountability for this crime without legal restrictions. In the case of Russia’s aggression against Ukraine, we need to urgently address this weakness now. The general assembly must take a lead. It has already repeatedly condemned Russia’s aggression against Ukraine and agreed there must be accountability for international crimes. To enforce this, it must create a special tribunal now to deal with the crime of aggression. Second, we need to recognise that the countries that most seriously violate international commitments to other countries are also more likely to have already violated their own domestic commitments to their citizenry. The promotion of human rights and basic freedoms needs to become a natural part of global security policy. Human rights violations cannot simply be ignored in one country when, in reality, they disrupt global inclusion and present dangers to the stability of the wider global system. Fundamentally, it is about ensuring all people are protected from violence. This is essential for those more likely to face risks of harm as a result of their work, such as human rights defenders and journalists. It’s also essential for marginal and vulnerable groups such as women and children, ethnic and religious minorities, refugees, migrants and those who are lesbian, gay, bisexual, and transgender. It is also about safeguarding freedom of speech, which includes both the freedom of the media and the freedom of the internet. Third, we must expand the inclusivity of international policymaking to make a world fit for freedom. That includes enabling the world’s small states and civil society to have a greater say in international matters that are traditionally decided by big states and blocs. We are at a pivotal moment in world history. The only certainty is that the existing international system cannot survive unchanged much longer. However challenging the world becomes, remember that it was during the very darkest days of the second world war that the rules-based world was developed in its current iteration. In the spring of 1941, almost all of Europe had fallen to the totalitarian powers. While victory for the allies was far from certain, representatives of occupied and allied nations met in bombed-out London to – in their words – “define some purpose more creative than military victory”. The conversation they started gathered momentum globally and led to the creation of the UN, whose charter they began drafting even prior to D-day, as well as the Nuremberg trials, which laid the foundation for modern international law and the ICC. That conversation should never have been considered finished. We must not wait for a repeat of the devastation that they endured. We can and must continue the momentum that they started and inspire a new global conversation on making the world fit for freedom. Margus Tsahkna is Estonia’s minister of foreign affairs",False,pillar/opinion,Opinion
