id,type,section_id,section_name,web_publication_date,web_title,headline,trail_text,body_text,is_hosted,pillar_id,pillar_name
politics/2023/jul/13/labour-rules-on-lobbying-would-clean-up-politics-says-angela-rayner,article,politics,Politics,2023-07-13T16:41:28Z,"Labour rules on lobbying would ‘clean up politics’, says Angela Rayner","Labour rules on lobbying would ‘clean up politics’, says Angela Rayner",Exclusive: Standards system reform would ban ex-ministers from taking lobbying jobs related to former brief for up to five years,"Labour would ban ministers from taking lobbying jobs related to their former brief for up to five years to “fix the broken standards system and clean up politics”. If the rules were breached, the former ministers would face fines decided by an independent commission, which could include losing a portion of their pension or the severance payment, in line with proposals outlined by the committee on standards in public life. The Guardian understands any former minister would need to approach the party’s newly proposed integrity and ethics commission before taking a paid role. The commission would then decide if the role was considered lobbying, advocacy or portfolio-related. The proposals for a new watchdog were first announced by the party in 2021. They include a promise to scrap Whitehall’s existing revolving-doors watchdog and introduce a more robust system. The advisory committee on business appointments (Acoba), which was responsible for reviewing Keir Starmer’s job offer to ex-civil servant Sue Gray, would be replaced by the commission, Labour said. While the commission would have the power to launch its own investigations when rules are broken, the deputy Labour leader, Angela Rayner, noted there will “still be a role for the prime minister”, when asked if the PM would have the final say on whether to accept the watchdog’s recommendations on sanctions. “Yes, there will still be a role for the prime minister, but because they won’t have a veto on starting an investigation and then the recommendations again … the prime minister at the moment appoints his adviser who does the investigations,” she told the Institute for Government. “It will be done through the independent ethics and integrity commission and then those recommendations will come to parliament.” As it stands, former ministers can leave office and receive huge sums of money lobbying on behalf of companies, profiting from their work serving the public and giving some companies privileged access to government officials and public funds. Rayner vowed to “stop the rot” by creating the new commission with stronger powers to punish those who break the rules and show the public that “politics is working for them” by the end of Labour’s first term in government. Speaking before her speech at the Institute for Government, Rayner said: “After taking a wrecking ball to the economy forcing up mortgage rates, the former prime minister Liz Truss is cashing in after crashing out of government. We have a system where the door is held wide open for former ministers who want to line their pockets as soon as they leave office. “Labour will stop the revolving door between government and the companies that ministers are supposed to regulate, banning ministers from lobbying after they leave office with proper enforcement against those who break the rules. “Labour recognises the standards system has been broken and we have a plan to clean up politics. Our genuinely independent ethics and integrity commission will bring the alphabet soup of existing committees and bodies that oversee standards in government under a single body, removed from politicians.” Rayner’s pledge comes amid fresh analysis seen by the Guardian that shows Liz Truss’s cabinet have received almost £300,000 in second-job income since the former prime minister was forced to resign on 20 October last year. Two former cabinet ministers under Truss, Brandon Lewis and Ranil Jayawardena, have taken on consulting jobs, while Truss and her chancellor, Kwasi Kwarteng, have started touring the speaking circuit. Truss is understood to have spoken more times in paid-for engagements abroad since she was forced to leave No 10 than she has in the House of Commons chamber. Rishi Sunak had promised to lead with “integrity, professionalism and accountability”, and after entering office appointed Sir Laurie Magnus as his independent adviser. Yet his cabinet was rocked after Gavin Williamson, Nadhim Zahawi and Dominic Raab were forced to quit over accusations over their conduct. The Conservative former minister Owen Paterson resigned from the Commons in 2021 after a scandal over his lobbying for two companies that employed him as a consultant. David Cameron, the former prime minister, was also involved in a lobbying scandal over his links to Greensill Capital. Responding to Rayner’s remarks, a Conservative party spokesperson said it’s “unsurprising to see that Angela Rayner doesn’t trust the leader of her own party to oversee ethics in Whitehall”.",False,pillar/news,News
commentisfree/2023/oct/03/sweden-us-culture-wars-politics-donald-trump,article,commentisfree,Opinion,2023-10-03T11:00:12Z,Sweden used to pride itself on moderation – until US-style culture wars poisoned our politics | Martin Gelin,Sweden used to pride itself on moderation – until US-style culture wars poisoned our politics,"Donald Trump gave our resentful reactionaries a playbook to copy. The vitriol will be hard to put back in the bottle, says Swedish journalist Martin Gelin","As a Swedish correspondent in the US, I have sometimes braced myself on trips back home for some drastic societal change I’d heard about, only to return home and find that things were in fact exactly as they’d always been. Drivers still followed the little white arrows on the road – government recommendations for maintaining safe distances between cars and a symbol of Swedish society’s strong adherence to rules and compliance. On the evening news, bureaucrats would have heated debates about such things as infrastructure and highway tolls. Politics was reliably boring; a sure sign of a healthy democracy. But over the past few years, something has genuinely changed. The political discourse is aggressive, focused on the culture wars, and seems stuck in a constant mode of outrage. The shrill vocabulary often seems to be lifted straight from American cable news. Gun violence and gang crime is at record levels – September was the most violent month for shooting deaths on record – and has helped stoke a culture of fear and an ever-escalating political blame game over immigration and asylum policies. Dehumanising immigrants is nothing new for Sweden’s nationalists and far-right groups. Now they and rightwing pundits’ attacks have broadened to encompass LGBTQ+ people, journalists, scientists, environmentalists, civil society, gun laws and an alleged cultural elite of educated urbanites failing to protect Swedish values. Björn Söder, a member of parliament for the far-right Sweden Democrats who is notorious for insulting Jewish and Sami Swedish people, this year turned his fire on the Stockholm Pride festival, an event that has been uncontroversial for two decades. He accused the prime minister, Ulf Kristersson, of “legitimising paedophilia” by participating in the event. As the recently appointed chair of the Swedish delegation of the Organization for Security and Co-operation in Europe (OSCE), Söder is not a marginal figure. His party is not formally part of the conservative governing coalition, but with 20.5% of the vote in the 2022 general election, the government needs its support to survive – it in fact directs much of the coalition’s actual policy. The Sweden Democrats’ leader, Jimmie Åkesson, meanwhile, spent most of a debate on national TV recently talking about “insane” drag queen story hours for children. Another conservative group has launched a campaign against the “bussing” of schoolchildren, framing a debate on education policy in terms that seemed Google-translated from American de-segregation politics of the 1970s. Swedish politics has always looked towards the US. For half a century, rightwing thinktanks and political organisations have sent their smartest strategists across the Atlantic to learn from the US conservative movement. But if I ever ran into a Swedish conservative visiting Washington DC, they were more likely to be on their way to a meeting with libertarian economists at the Cato Institute or an old cold war diplomat at the American Enterprise Institute rather than visiting anti-abortion activists at the Heritage Foundation or fire-breathing nationalists at CPAC. The emphasis was firmly on learning about rightwing economic policies, deregulation and free-market ideas. This changed after Donald Trump’s election. “Strategists from the Sweden Democrats and the Christian Democrats embarked on countless trips to the US to learn from the Maga conservatives, and many even worked within the Trump campaign,” says Billy McCormac. McCormac is a veteran of the centre-right thinktank Timbro and, like myself, both Swedish and American. He used to call himself a Republican, but now belongs to a generation of Swedish conservatives who are revolted by Trump. They may be a minority. Nationalism and xenophobic populism were certainly not invented in the US. Geert Wilders and France’s Le Pen family were stirring things up against European migrants a decade before Trump. But Trump’s presidency popularised these narratives globally, and emboldened Swedish nationalists to copy-paste the worst aspects of his style. Andreas Johansson Heinö, a political scientist who also works for Timbro, describes a generational shift. “Intellectuals and ideologues used to join conservative institutions here because of their views on economic policy, tax and the welfare state. Now, there’s a new generation who came into politics precisely because of the culture war, not despite it. Cultural issues are the reasons they became conservatives.” The escalation of political attacks on drag queens, young climate activists, feminists and Muslims is partly a reawakening of older, dormant forms of prejudice and bigotry. But Trump gave angry, resentful reactionaries a playbook to copy. “The Sweden Democrats looked at the Trump movement to figure out how to harness those emotions politically,” Lisa Pelling, the director of the centre-left thinktank Arena, explains. * * * Recent shifts in public opinion also explain why conservative tacticians see an opportunity in whipping up fears about so-called “Swedish values” under threat. The first is a rightward shift in attitudes towards migration. For several decades, Sweden took pride in its welcoming immigration policy. Fredrik Reinfeldt, the Moderate party prime minister, famously left office in 2014 advocating for Swedish citizens to “open your hearts” to refugees. Hundreds of thousands of asylum seekers came to Sweden in the mid-2010s, most of them from Syria, Afghanistan and Iraq. The country took in the highest per capita number of refugees in the EU in 2015. But amid a proliferation of what Johansson Heinö calls “conservative narratives” in the media, and the rise of the Sweden Democrats, the public mood hardened away from multiculturalism. “This is one of the most significant polling shifts in Swedish history. After the surge of migrants in 2014 and 2015, conservative narratives dominated the discourse, and we saw a very distinct opinion shift,” says Johansson Heinö. It led to a radical tightening of immigration policies. Gun violence – which escalated this summer – has provoked both soul-searching about social exclusion and conservative crime narratives that scapegoat immigrant communities. It is worth noting that unlike elsewhere in Europe, Swedish voters distinguish between the positive economic benefits of immigration and a perceived connection to rising crime and insecurity. The second shift is that Swedes have become significantly more likely to say they want an end to privatisation in healthcare, schools and social services. Seven out of 10 Swedes now want the government to run healthcare, a clear revolt against the austerity and deregulation programmes of the past three decades. As an electoral strategy, the combined parties of the rightwing coalition now believe that they can win by moving the debate away from the economy and the Swedish welfare model, and on to the supposed threat migration poses to Swedish identity and traditional values. The centre-left opposition, meanwhile, is seeking to shift the conversation back to the economy, the welfare state and the number of nurses and teachers. And while this has helped it to its strongest position in polling for years, its silence on migration means the far right’s fearmongering narratives are also given a free pass. Magdalena Andersson, a former Social Democrat prime minister, tells me she thinks the best way to protect marginalised groups is to win elections. “And we won’t win elections if the conversation is solely about drag-queen story hours.” As prime minister, Andersson said the country had failed to integrate many of its immigrants, allowing a nation of segregated and “parallel societies” to emerge. The Social Democrats may have believed they could “neutralise” the far right by supporting stricter border controls and decreased immigration. Instead, this shifted the immigration debate irrevocably to the right, says Lisa Pelling. It has allowed the nationalists to advance a more radical agenda on other issues, including advocating for American-style gun laws, attacking LGBTQ+ people and reshaping culture policies around nationalist ideas. There are at least some indications that the combined right may have overreached. A grassroots protest movement recently emerged, with civil society organisations and thousands of citizens rallying against a new law that requires doctors, teachers and a wide range of public sector employees to report the presence of undocumented people even in hospitals or libraries. When this policy was first suggested by the far right, mainstream conservatives dismissed it as the Stasi-style tactics of tyrants and old communist regimes. Now they support it. People refusing to act as informants in a system they see as becoming inherently xenophobic are perhaps the voice of Sweden’s new silent majority, belatedly organising to sustain a tolerant society. In any case, the outcry should be a reminder that culture wars can backfire on those who stoke them. Some Swedish conservatives are asking if it has all gone too far: Magnus Jacobsson, a centre-right member of the Riksdag, recently accused his own side of stoking the fires of xenophobia, blaming immigrants for problems with much more complex roots. But once unleashed, the culture wars rarely retreat from public life. “It is too easy to dismiss these debates as something that revolves around symbols. They are actually about what kind of society we want to live in,” says Johansson Heinö. Swedish politics is not as grimly polarised as the US’s yet, but the vitriol that has risen to the surface in recent years is probably here to stay. Martin Gelin is the US correspondent of the Swedish newspaper Dagens Nyheter and the author of Den vita stormen: Rasismens historia och USA’s fall (The White Storm: How Racism Poisoned American Democracy) Do you have an opinion on the issues raised in this article? If you would like to submit a response of up to 300 words by email to be considered for publication in our letters section, please click here.",False,pillar/opinion,Opinion
world/2023/dec/14/japans-ruling-party-engulfed-by-political-fundraising-scandal,article,world,World news,2023-12-14T04:59:11Z,Japan’s ruling party engulfed by political fundraising scandal,Japan’s ruling party engulfed by political fundraising scandal,Four ministers resign amid reports that prosecutors were poised to raid offices of dozens of ruling party MPs,"Japan’s prime minister, Fumio Kishida, is battling to contain the fallout from a political fundraising scandal that forced the resignations of four of his ministers, amid reports that prosecutors were poised to raid the offices of dozens of ruling party MPs. The chief cabinet secretary, Hirokazu Matsuno, confirmed that he was stepping down, while the economy and industry minister, Yasutoshi Nishimura, the internal affairs minister, Junji Suzuki, and the agriculture minister, Ichiro Miyashita, have also resigned. The targeted ministers are members of the 100-strong Abe faction – once led by the assassinated former prime minister Shinzo Abe – the largest grouping of MPs in Kishida’s ruling Liberal Democratic party (LDP). Prosecutors are investigating allegations that members of Abe’s faction failed to report about ¥500m (£2.7m) raised via fundraising parties over the past five years. Investigators are looking into whether Kishida’s faction is also involved, according to media reports. The group is suspected of failing to declare more than ¥20m in the three years to 2020, the Asahi Shimbun newspaper reported. Japanese political parties routinely organise events attended by supporters to raise funds, with the profits ploughed back into campaigning. Holding gatherings to raise funds is legal. Members of the Abe faction reportedly exceeded their ticket sales quotas and pocketed the difference. That, too, is not a crime. But their alleged failure to record the sums in official statements would be a violation of political funding laws. “If you are confident of selling tickets, and you sell more than you are obliged to sell, that will all become your income … it’s easy,” a senior official who used to work in the office of an LDP lawmaker told the broadcaster ANN, his face concealed and voice disguised. On Thursday, Matsuno, who is also chief government spokesman, told reporters that Michiko Ueno, a special advisor to Kishida, was also leaving office as well as five deputy ministers. Nishimura said anger over his alleged involvement in the funding scandal was damaging public trust in the government. “As an investigation is ongoing, I thought I should set things right,” he told reporters. Kishida said this week he planned to deal with the allegations “head-on” as his administration sank into disarray. “I will make efforts like a ball of fire and lead the LDP to restore the public’s trust,” he said. The allegations come at the worst possible time for Kishida, who last week resigned as head of his own LDP faction in an attempt to appear more neutral on the growing financial scandal. His approval ratings are at their lowest – 23% – since he took office in late 2021, amid voter anger over a deepening cost-of-living crisis and plans to raise taxes to fund record defence spending. Support for the LDP, which has governed almost uninterrupted for decades, has also fallen below 30% for the first time since 2012, when it returned to power after a brief period in opposition, an NHK survey on Tuesday showed. Kishida said this week he planned to take “appropriate measures” to rebuild public trust in his government, but some analysts did not believe a cabinet clearout would draw a line under the scandal, given the questions it raised about his leadership. “At this stage, the most Kishida can hope for is to arrest the current decline in his personal support,” said Corey Wallace, an associate professor of political science and international relations at Kanagawa University. “Increasing it, however, will require more than cosmetic changes to personnel.” The next lower house election is not due until October 2025 at the latest but the scandal has fuelled speculation that Kishida could face a challenge for the party’s leadership when it elects a new president next September – assuming he survives until then.",False,pillar/news,News
world/2023/jul/10/dutch-pm-mark-rutte-to-leave-politics-after-collapse-of-government,article,world,World news,2023-07-10T12:32:17Z,Dutch PM Mark Rutte to leave politics after collapse of government,Dutch PM Mark Rutte to leave politics after collapse of government,Netherlands’ longest serving PM announces decision after coalition resigned in row over immigration,"The four-time Dutch prime minister, Mark Rutte, has announced his departure from politics after the collapse of his coalition government in a row over immigration. His decision means the end of more than 13 years in power for the conservative leader sometimes called “Teflon Mark” because scandals that plagued his four different administrations did not stick to him. The Netherlands’ longest-serving government leader told an emergency parliamentary debate on Monday morning that he would not lead his People’s party for Freedom and Democracy (VVD) into general elections expected in November and would instead leave politics after the vote. Rutte said: “In the past few days, people have speculated about what motivates me, and the only answer is: the Netherlands. My position is completely subservient to the country. Yesterday morning I took the decision that I will no longer be available to head the VVD list. When a new government takes over, I shall leave politics.” The coalition collapsed over Rutte’s plans to tighten curbs on reuniting families of asylum seekers, in an attempt to curb numbers or arrivals after the overcrowding scandal. He had announced on Friday night that his four-party government had broken down over the issue of asylum and “unbridgeable” differences. Immigration has become one of the most contentious issues in the Netherlands since last autumn, when there were desperate scenes at a registration centre in Ter Apel, with people sleeping outside for days and a baby dying in a crowded sports hall. Rutte will remain at the head of a caretaker government unable to take decisions on controversial issues such as house building, pollution, a cost of living crisis and asylum until a successor is in place following the elections. Plaudits for Rutte’s long tenure came in from industry, relatives of 196 Dutch nationals killed in the shooting down of the airliner MH17 over eastern Ukraine in 2014, as well as opposition MPs. Rutte, 56, said he had “mixed feelings” but it was “also a relief to hand over the baton”. He was not interested in a job like leading Nato, he said, but might well expand his citizenship teaching job at a local school to two days instead of one. GreenLeft on Monday withdrew the motion of no confidence in Rutte as caretaker PM, with its leader Jesse Klaver saying he had put “the interests of the country first” with his decision to announce his exit from politics. The outcome of the expected mid-November general election is unpredictable in the multiparty, fragmented Dutch system, where trust in government is at historic lows. After the resignation of Rutte’s government, the far-right anti-immigration PVV led by Geert Wilders started campaigning and the flags went out for Caroline van der Plas’s Farmer-Citizen Movement (BBB), a surprise winner in provincial elections in March. The rightwing populist BBB runs on a pro-farmer ticket at a time when the Netherlands must drastically reduce nitrogen-based pollution. Wopke Hoekstra, the leader of the Christian Democratic Appeal, the traditional farming party, has already said he would not lead the CDA into elections after a collapse in support this year. GreenLeft and Labour said at the weekend they would ask their members to form a leftwing coalition going into elections.",False,pillar/news,News
