id,type,section_id,section_name,web_publication_date,web_title,headline,trail_text,body_text,is_hosted,pillar_id,pillar_name
commentisfree/2023/dec/29/british-politics-local-councils-ministers-town-hall-democracy,article,commentisfree,Opinion,2023-12-29T11:00:03Z,British politics is rotting from the bottom up: pity our crisis-hit local councils | Simon Jenkins,British politics is rotting from the bottom up: pity our crisis-hit local councils,"The collapse of town hall democracy is a scandal unfolding in real time, says Guardian columnist Simon Jenkins","Every review of Britain 2023 says the same. The country is not being well run. From policing to care homes, from postal services to sewage spills, from youth clubs to potholes, everywhere is failure. Small wonder just 20% of Britons now have any faith in their national politicians, one of the lowest figures in a western democracy. Nowhere is this decline more evident than in local government. It is going bust. Birmingham, Nottingham, Croydon and four other councils in England have issued section 114 notices since 2020, indicating that their expenditure will exceed income. According to the Local Government Association (LGA), in the coming year, one in five councils expect to fail financially. Commissioners have already been sent to Woking and Slough, effectively suspending their local democracy. In most of what they do, councils now act as agents of Whitehall instruction – as with children in need, care of elderly people and dispensing housing benefit. Yet the money to do this has been butchered in 13 years of austerity, with a 40% real-terms cut in central grants. Money for anything considered “discretionary” – public libraries, sports facilities, local colleges, the arts, the stuff of community life – has evaporated. The LGA estimates a cash shortfall of £4bn over the current two-year period. This is a fraction of what successive governments have spent on that white elephant, HS2. Rishi Sunak won’t give Birmingham another penny but he will happily speed Brummies to the bright lights of London. This week, the new head of the Office for Local Government, Lord Morse, blamed much of the trouble on councils’ “failures in management or failures in governance”. Some, such as Croydon, have reportedly mishandled their assets, many in a desperate attempt to earn revenue from property. Many have become such dispiriting places to work that able councillors and staff have disappeared. But for a central quango to blame the impending crisis on local recklessness is grossly unfair. I would rather trust an average local council to handle defence procurement or transport investment than leave it to the Treasury just now. As it is, the only source of new money for many councils is traffic fines. A desperate Manchester council reveals it has raised £10m in penalties from just one bus lane in less than two years, while the City of London squeezed £8m from a single junction outside the Bank of England in one year. The instinct of central government is to “nationalise” what it sees as local failure. Since the 1980s this has happened over secondary and further education and the capping of local taxation. The latest battle has been over planning. Changes last year by the levelling up secretary, Michael Gove, to the housebuilding regime have on the whole been respectful of local discretion. But two weeks ago he turned turtle and lambasted councils that did not do as he wanted for being nimbys. If they did not plan for more houses within a year, he would overrule them and bring local planning decisions under the control of Whitehall. Since 86% of planning applications are approved locally and without delay, this kneejerk centralisation would be bureaucratic madness. Labour is no different. Keir Starmer said in his last conference speech that he wants to “bulldoze” through local planning laws. He sees local councils as no more than Whitehall housebuilding agencies. Like Gove, he wants to see 300,000 new houses built and does not want local people or their representatives getting in the way. This centralisation of town and country planning will make Rwanda seem like a picnic. Every planning decision will become a battle in the courts. Whitehall cannot possibly ordain the fate of every acre of land in England. At root is the future of local democracy. British politics is rotting from the bottom up. Britons used to run the majority of public services through locally elected bodies, as do most democracies in Europe. The removal of the big three – health, education and housing – has not sent British standards shooting up but on the whole into decline. Regulation, bureaucracy and targetry have gradually strangled frontline management. Across Europe, most locally elected bodies have power, resources and the status to match. It is considered an honour to serve on them. In Germany, the Low Countries and Scandinavia, they raise their own taxes, build houses, run schools and clinics, and maintain churches and historic buildings. They do few of these things in Britain. It is a wonder people still bother to stand as councillors. Local government contrived to keep its show on the road during David Cameron and George Osborne’s austerity blitz of the 2010s. Some councils made mistakes. But now push has come to shove. The biggest local sector, social care outside the NHS, has been savaged by cuts and is stumbling as a debilitated state agency. Chronically short of 150,000 staff, its inability to handle hospital discharges has sorely damaged Whitehall’s pet service, the NHS. Now it is discretionary services that are for the chop. Not a week passes without a local library, swimming pool or day centre being declared unnecessary. The freedom of local people, through their votes and their taxes, to sustain the fabric of community life is curtailed by a national political culture that simply does not care. Attacking localism for the faults of centralism is a lie, one that will do nothing but further harm. Simon Jenkins is a Guardian columnist",False,pillar/opinion,Opinion
australia-news/2023/dec/09/somehow-australian-politics-has-delivered-a-christmas-miracle-and-thats-a-big-deal,article,australia-news,Australia news,2023-12-08T14:00:54Z,Somehow Australian politics has delivered a Christmas miracle – and that’s a big deal | Katharine Murphy,Somehow Australian politics has delivered a Christmas miracle – and that’s a big deal,Anthony Albanese’s success in pushing ahead on NDIS reform is a triumph of hope over experience. Can Peter Dutton rise to the occasion?,"It’s been a difficult year for so many people. Many of us are battling adversity of one type or another and we are reminded very often that the world is a dangerous and – at times – ugly place. Closer to home, we’ve seen a dispiriting revival of zero-sum politics, supercharged by a media cycle geared to making news consumers feel things as opposed to thinking about them. But rather than slide into a funk, let’s consider two positive things that happened during the final parliamentary sitting week of 2023. The first was (as Bill Shorten, the minister for the national disability insurance scheme, put it) “for a moment in time, federation worked”. That was Christmas miracle number one: a productive national cabinet meeting on Wednesday. Anthony Albanese struck a deal with the states and territories to split the cost of disability services outside the NDIS in return for a further three years of GST funding. Number two was the release of the NDIS review by the economist and disability advocate Bruce Bonyhady and former senior public servant Lisa Paul. This is a quality piece of work. The review starts from an important and (dare we say) uplifting premise: sometimes, the governments of Australia decide to change Australia for the better. It characterises the NDIS, legislated in 2013, as a “public policy miracle” – a world-leading scheme supported across the political spectrum. Sign up for Guardian Australia’s free morning and afternoon email newsletters for your daily news roundup Given there are so many incentives for acting like a numpty in politics, the reviewers are dead right. The existence of the NDIS is a miracle, and the effect of the reform has been life-changing for many Australians. I know this from experience. Some people near and dear to me are supported by the NDIS. The scheme covers costs of care that are well beyond the means of most households. If you luck out, with a great team providing support, everybody benefits, not just the 610,000 current recipients. But anyone with any exposure to the scheme also knows it’s not perfect. Navigating the NDIS is so complicated that many people opt for having plan managers rather than approaching the labyrinth themselves. Decisions and reassurance are not instant, and that causes anxiety. Some of the prices being charged for goods and services are also, very obviously, extortionate. It’s clear Bonyhady and Paul come to save the NDIS, not to kill it. The case for change is shared in clear and accessible language. NDIS users and their families sit at the centre of the policy thinking. Bottom-up empathy gives the review, for this reader at least, considerable authority. Let’s step through the story it tells quickly. The NDIS is supporting 101,000 more participants than was projected by the Productivity Commission back in 2017. The scheme cost taxpayers more than $35bn in 2022-23 – $8bn more than was projected in 2017. More than half of scheme participants are kids. There are a number of drivers of growth. For most people, help is the NDIS, or nothing. People with disabilities lack access to foundational supports. There are few inclusive mainstream services, and that vacuum “pushes people towards the NDIS” – an uncapped scheme where “what is considered reasonable and necessary isn’t well defined”. Given the reality is NDIS or bust, if you qualify, you don’t want to leave. Once inside, because of the way the scheme operates, with a “use it or lose it” mentality, people get anxious their care will be cut if they don’t use everything in their plan. The National Disability Insurance Agency is viewed as inflexible. People don’t want to run the gauntlet of trying to get more services if their circumstances change. These dynamics are symptomatic of a structural problem. The review says “poor design and implementation issues are driving the behaviour of everyone in the system”. Pricing is out of whack. Because there is not enough visibility of transactions, it can be hard to identify fraud. To keep a firmer hand on the number of new entrants, the review says eligibility for the NDIS should be determined by a person’s functional capacity rather than a more generic medical diagnosis. A navigation function would also replace the current system of plan managers. Shorten this week characterised the current arrangements as a form of glorified ticket clipping – a person with a disability having to reserve a portion of their NDIS package to pay someone “who you send an invoice to, who then sends it to the government”. Bonyhady and Paul say the scheme has to be adjusted because the NDIS will lose its social licence if things continue the way they are. This is a clarifying thought. Another clarifying thought: reform has to be implemented holistically. That means looking at what’s not working in the NDIS, and filling the measurable gaps in support and services outside the scheme. These are two halves of a whole. The review is very clear: governments will not fix the NDIS problems if they aren’t prepared to fix all the problems. This brings us back to national cabinet, and the miracle of the week. While much of the intra-day punditry of the final parliamentary sitting week fixated on Albanese’s political “crisis” after the high court’s ruling on indefinite detention, and whether or not Mark Dreyfus should have shouted at a journalist from Sky News – the national cabinet pushed forward on NDIS 2.0. Albanese, premiers and chief ministers agreed that states and territories would increase their contributions in line with growth in the NDIS from 2028, and Canberra and the states would jointly design the missing foundational supports recommended by the review. The additional costs of those services would be split 50-50. National cabinet comity always comes at a price. To help prioritise that and other service delivery, Albanese agreed to extend GST funding for three years from 2027-28. That three-year extension will cost the federal budget $10.5bn. There was additional health funding as well. Let’s be clear. Securing that handshake is the easiest part of an NDIS-plus redux. A system overhaul, watched intently by hundreds of thousands of stretched and stressed stakeholders, is politically fraught. It’s also fair to say that no political agreement with a five-year transition timeline (which is what the review recommends) is ever set in stone, given the frequency of election cycles. Doing what the reviewers recommend, as opposed to talking about it, will be extremely hard. Achieving the preferred best practice will involve precision policy work and a degree of goodwill on the part of governments and oppositions that feels ludicrously utopian after the year we’ve just had. But let’s persist with our clarity. This week’s national cabinet handshake is the foundation of all the policy work to come. That makes it a big deal. Without that agreement, any best-practice overhaul would have been dead on arrival. Another worthy review would gather dust on a shelf. While the road ahead is arduous, and the potential for squibbing and backsliding absolutely, depressingly, endless – it seems reasonable to speculate that Albanese and Shorten will want to future-proof one of the great Labor policy achievements. Whether Peter Dutton will rise to the occasion feels more moot given the long list of important issues the opposition leader has been prepared to weaponise over the past 12 months. But let’s allow hope to triumph over experience for a moment on a sunny summer Saturday. Let’s also agree there has been reverse weaponisation – Labor in opposition made it hard for previous Coalition governments to go anywhere near NDIS reform. Returning finally to the public policy miracle of getting the scheme off the ground in the first place – Julia Gillard managed to legislate the scheme in a minority parliament. Unlike the carbon price, the NDIS managed to survive Tony Abbott’s precision partisan ferocity. Albanese has said often one of the most difficult lessons he learned from the 43rd parliament was seeing how easy it was for Abbott to rip up important reforms by the roots. This trauma informs the stylistic and substantive objectives of Albanese’s prime ministership. This experience made Albanese focused on trying to run an orderly government capable of staying in office long enough to make change durable. But the lesson of this year is you can’t control the play. Events, and the objectives of opponents, shape a prime minister’s political destiny as much as strategy. The brutal atmospherics over these past few months, the weaponisation of the voice referendum and the grim opportunism since, has reminded me of 2013. Albanese is in a different position to Gillard in many significant respects, but the hyper-partisanship and the febrile media climate sometimes feels analogous. Rather than taking Abbott’s wrecking as the primary lesson of a decade ago, Albanese could take something valuable, too, from Gillard’s pluck. Gillard pushed ahead in sustained adversity, declining to take a backward step. Sometimes, when something’s important, orderly and incremental won’t do the job. You have to pin back your ears, and go for it.",False,pillar/news,News
us-news/2023/aug/24/belligerence-and-hostility-trumps-mugshot-defines-modern-us-politics,article,us-news,US news,2023-08-25T15:51:56Z,Belligerence and hostility: Trump’s mugshot defines modern US politics,Belligerence and hostility: Trump’s mugshot defines modern US politics,"From Bugsy to Bowie, every decade had its defining booking photo. Now we have ours for these politically spiteful times","Mugshots define eras. Bugsy Siegel peering malevolently from beneath his fedora in a 1928 booking photo summed up the perverse romance of gangsters in the prohibition age. Nearly half a century later, mugshots of David Bowie, elegantly dressed but dead-eyed after his arrest for drug possession, and a dishevelled Janis Joplin, detained for “vulgar and indecent language”, spoke to the shock waves created by 1960s counterculture. Now comes what Donald Trump Jr described as “the most iconic photo in the history of US politics” before the booking picture of his father glaring into the camera was even taken. But whether deeply divided Americans view the first ever mugshot of a former president as that of a gangster or a rock star is very much in the politics of the beholder. Trump’s hostility shines through as he turns his eyes up toward the camera above him and in his taut, downturned mouth as he is booked into the Fulton county jail on charges of trying to steal the 2020 presidential election. Dressed in a blue suit, white shirt and red tie, he makes no attempt to put on a smile like some of his co-defendants in their mugshots. The picture does not flatter but it does convey the message many of Trump’s supporters want to hear – belligerence. The six-pointed star of the Fulton county sheriff’s office badge and the name of the sheriff, Patrick Labat, sits in the top left hand corner of the picture. But some will be disappointed that Trump is not seen in the classic pose holding a board in front of his chest with his name and date of arrest. Still, the mugshot will now enter the pantheon of famous-name booking photos, alongside Frank Sinatra looking unperturbed after his arrest in 1938 for “carrying on with a married woman”, and Hugh Grant after he was found with a sex worker on Sunset Boulevard. Trump has some way to go to catch up with the American actor Lindsay Lohan’s eight-year run of mugshots for theft, drugs and driving offences. The former president’s supporters are already embracing the booking photo as a badge of honour and defiance. It will be held up as evidence that their man will not give up the fight against a system his followers see as ever more determined to bring him down and prevent him returning to the White House. Far-right congresswoman Lauren Boebert led the way with a tweet proclaiming: “Not all heroes wear capes.” The president’s detractors, on the other hand, will see the booking photo as evidence that even a man who was once the most powerful person in the land cannot escape the might of the justice system. Some will welcome anything that makes him look even a little bit more criminal as a confirmation that sooner or later he is going to prison. The accused may be presumed innocent until a plea or a jury says otherwise but mugshots can have a way of conveying guilt. For Trump though, the picture is likely to prove yet another money spinner. Within hours, his campaign fundraising website was advertising T-shirts, bumper stickers and coffee mugs glorifying a martyred Trump with the booking photo above the words “never surrender!”. Sales are likely to be brisk given the enthusiasm with which the former president’s supporters now treat each public humiliation as an accomplishment. Two impeachments and four sets of indictments, from financial fraud to a slew of charges over the 2020 election, have done little to damage Trump’s standing among the true believers, and have only bolstered his run for the Republican presidential nomination. Such is the strength of that belief that a recent CBS poll showed Trump voters trust him more than their own family members and religious leaders. Ordinary Americans have already got creative in response to the flood of indictments by mocking up pictures of the former president in an orange jump suit a la Guantánamo prison and in printing T-shirts with Trump in various states of detention with slogans declaring “Trumped up charges”, “Guilty AF”, “Guilty of winning” and “Legend”. There will be plenty who will challenge Don Jr’s claim that the mugshot has instantly become the most iconic photo in US political history. Pictures of John F Kennedy’s assassination or Martin Luther King Jr leading the march for freedom or a host of other historic moments will surely prove more enduring. But as with the gangsters and rock stars, Trump’s booking photo may come to define an era – one of unusual political turmoil that has yet to resolve whether his next mugshot is as an inmate.",False,pillar/news,News
